{
    "SamplesAnalysisID": "opendes:work-product-component--SamplesAnalysis:GCMSMS_SamplesAnalysis:",
    "SampleID": "opendes:master-data--Sample:GCMSMS_Sample:",
    "GasChromatographyTandemMassSpectrometryAnalysis": [
        {
            "CompoundCode": "opendes:reference-data--GCMSMSCompounds:Abietane:",
            "RetentionTime": {
                "Value": 1.0,
                "UnitOfMeasure": "opendes:reference-data--UnitOfMeasure:s:"
            },
            "Ions": [
                "ABCDEFGHIJKL"
            ],
            "Peak": [
                {
                    "Value": 1.0,
                    "UnitOfMeasure": "opendes:reference-data--UnitOfMeasure:s:",
                    "AreaHeightQualifier": "opendes:reference-data--CompoundsAreaHeight:Height:"
                }
            ]
        }
    ],
    "StdCompound": {
        "CompoundCode": "opendes:reference-data--GCMSMSCompounds:Beyerane:",
        "RetentionTime": {
            "Value": 1.0,
            "UnitOfMeasure": "opendes:reference-data--UnitOfMeasure:s:"
        },
        "Ions": [
            "ABCD",
            "ABCDEFGHIJKLMN"
        ],
        "Peak": [
            {
                "Value": 1.0,
                "UnitOfMeasure": "opendes:reference-data--UnitOfMeasure:s:",
                "AreaHeightQualifier": "opendes:reference-data--CompoundsAreaHeight:Height:"
            },
            {
                "Value": 1.0,
                "UnitOfMeasure": "opendes:reference-data--UnitOfMeasure:s:",
                "AreaHeightQualifier": "opendes:reference-data--CompoundsAreaHeight:Height:"
            }
        ]
    }
}
